{
  "id": "11111111-1111-1111-1111-111111111111",
  "run_id": "22222222-2222-2222-2222-222222222222",
  "action_id": "33333333-3333-3333-3333-333333333333",
  "sha256": "e3b0c44298fc1c149afbf4c8996fb92427ae41e4649b934ca495991b7852b855",
  "artifacts": [
    {
      "path": "reports/scan_output.xml",
      "sha256": "ba7816bf8f01cfea414140de5dae2223b00361a396177a9cb410ff61f20015ad",
      "size_bytes": 4096
    }
  ],
  "timestamp": "2026-10-02T16:06:00Z"
}
